{
  "profileId": "employment-letter",
  "version": "1.0.0",
  "documentType": "employment-letter",
  "expectedIssuers": ["employer", "authorized employer representative"],
  "acceptedProducers": ["adp", "ceridian", "dayforce", "nethris", "payworks", "workday"],
  "acceptedProducerClasses": ["generator", "ocr", "scanner"],
  "expectedFields": ["date issued", "employment status", "employer"],
  "pageCount": { "min": 1, "max": 3 },
  "fontCount": { "min": 1, "max": 6 }
}
